{
  "schema": "live-view-kit.v1",
  "id": "meeting-follow-through",
  "title": "Meeting follow-through",
  "description": "Turn your latest meeting into decisions, owned actions, open loops, and a clear next step.",
  "outcome": "Leave the latest meeting with a source-backed record of what was decided, who owns what, and what should happen next.",
  "decisions": [
    "What was explicitly decided?",
    "Which action is mine, and when is it due?",
    "What unresolved question needs follow-through first?"
  ],
  "trustBoundary": "Suggestions are not promoted to decisions, and owners or deadlines appear only when they were actually stated.",
  "version": 2,
  "pipes": [
    {
      "name": "meeting-summary",
      "distribution": "bundled"
    },
    {
      "name": "missed-todos",
      "distribution": "bundled"
    }
  ],
  "template": {
    "schema": "live-view-template.v1",
    "id": "meeting-follow-through",
    "title": "Meeting follow-through",
    "revision": 1,
    "timeRange": "24h",
    "periodPolicy": {
      "type": "selectable.v1",
      "values": ["24h", "7d", "30d"]
    },
    "blocks": [
      {
        "id": "latest-meeting",
        "title": "Latest meeting",
        "kind": "markdown.v1",
        "width": 12,
        "order": 0,
        "intent": "Summarize the most recent substantive meeting inside the selected period, naming the meeting and its source-backed purpose and outcome.",
        "source": {
          "type": "pipe.v1",
          "pipeName": "meeting-summary"
        }
      },
      {
        "id": "decisions",
        "title": "Decisions",
        "kind": "list.v1",
        "width": 6,
        "order": 1,
        "intent": "List explicit decisions made in the most recent substantive meeting inside the selected period. Do not turn suggestions into decisions.",
        "source": {
          "type": "pipe.v1",
          "pipeName": "meeting-summary"
        }
      },
      {
        "id": "action-items",
        "title": "Action items",
        "kind": "list.v1",
        "width": 6,
        "order": 2,
        "intent": "List explicit action items from the most recent substantive meeting inside the selected period, including owner and timing when stated.",
        "source": {
          "type": "pipe.v1",
          "pipeName": "meeting-summary"
        }
      },
      {
        "id": "people-and-context",
        "title": "People and context",
        "kind": "table.v1",
        "width": 6,
        "order": 3,
        "intent": "Show the people, organizations, roles, and relevant context explicitly present in the most recent substantive meeting inside the selected period.",
        "source": {
          "type": "pipe.v1",
          "pipeName": "meeting-summary"
        }
      },
      {
        "id": "open-loops",
        "title": "Open loops",
        "kind": "list.v1",
        "width": 6,
        "order": 4,
        "intent": "Find unresolved questions, promised follow-ups, and incomplete commitments connected to the most recent meeting inside the selected period.",
        "source": {
          "type": "pipe.v1",
          "pipeName": "missed-todos"
        }
      },
      {
        "id": "next-step",
        "title": "What to do next",
        "kind": "markdown.v1",
        "width": 12,
        "order": 5,
        "intent": "Recommend the next concrete follow-through step for the most recent meeting based on its explicit decisions, action items, and open loops.",
        "source": {
          "type": "pipe.v1",
          "pipeName": "missed-todos"
        }
      }
    ],
    "createdAt": "2026-07-24T00:00:00Z",
    "updatedAt": "2026-07-24T00:00:00Z"
  }
}
