{
  "schema": "live-view-kit.v1",
  "id": "time-and-focus",
  "title": "Time & focus",
  "description": "See active time, focus, app usage, and the shape of your day.",
  "outcome": "See where measured active time went and choose one concrete change to protect the next focused work period.",
  "decisions": [
    "Which projects and applications received the most active time?",
    "Where did task switching break sustained work?",
    "What is one evidence-backed adjustment for the next period?"
  ],
  "trustBoundary": "Active time excludes idle gaps; project labels and focus patterns remain unavailable where capture cannot support them.",
  "version": 2,
  "pipes": [
    {
      "name": "time-breakdown",
      "distribution": "bundled"
    }
  ],
  "template": {
    "schema": "live-view-template.v1",
    "id": "time-and-focus",
    "title": "Time & focus",
    "revision": 1,
    "timeRange": "today",
    "periodPolicy": {
      "type": "selectable.v1",
      "values": ["today", "24h", "7d", "30d"]
    },
    "blocks": [
      {
        "id": "active-time",
        "title": "Active time",
        "kind": "metric.v1",
        "width": 3,
        "order": 0,
        "intent": "Calculate total active computer time inside the selected period, excluding idle gaps. Return the duration in minutes or hours and describe coverage gaps.",
        "source": {
          "type": "pipe.v1",
          "pipeName": "time-breakdown"
        }
      },
      {
        "id": "sustained-work",
        "title": "Longest sustained work",
        "kind": "metric.v1",
        "width": 3,
        "order": 1,
        "intent": "Report the longest evidence-backed interval of active work on one project or workstream. State the continuity and idle-gap rule in the delta field; return unavailable when project continuity cannot be supported.",
        "source": {
          "type": "pipe.v1",
          "pipeName": "time-breakdown"
        }
      },
      {
        "id": "time-by-application",
        "title": "Time by application",
        "kind": "bar-chart.v1",
        "width": 6,
        "order": 2,
        "intent": "Group active time in the selected period by application and return the largest categories with durations in minutes.",
        "source": {
          "type": "pipe.v1",
          "pipeName": "time-breakdown"
        }
      },
      {
        "id": "workstream-transitions",
        "title": "Workstream transitions",
        "kind": "line-chart.v1",
        "width": 6,
        "order": 3,
        "intent": "Count evidence-backed transitions between different projects or workstreams in evenly spaced intervals. Do not count application changes inside the same supported workstream, and show coverage gaps instead of assigning a focus score.",
        "source": {
          "type": "pipe.v1",
          "pipeName": "time-breakdown"
        }
      },
      {
        "id": "time-by-project",
        "title": "Time by project",
        "kind": "bar-chart.v1",
        "width": 6,
        "order": 4,
        "intent": "Group active time in the selected period by evidence-backed project or workstream. Use Unclassified when the project cannot be determined.",
        "source": {
          "type": "pipe.v1",
          "pipeName": "time-breakdown"
        }
      },
      {
        "id": "workday-timeline",
        "title": "Activity timeline",
        "kind": "timeline.v1",
        "width": 6,
        "order": 5,
        "intent": "Show the major work intervals in chronological order for the selected period, with timestamps, applications, and concise activity context.",
        "source": {
          "type": "pipe.v1",
          "pipeName": "time-breakdown"
        }
      },
      {
        "id": "next-focus-change",
        "title": "One change for the next period",
        "kind": "markdown.v1",
        "width": 12,
        "order": 6,
        "intent": "Recommend one small, reversible change to protect sustained work in the next period, tied to a specific measured pattern above. Define what to observe next time and avoid treating application category as productivity.",
        "source": {
          "type": "pipe.v1",
          "pipeName": "time-breakdown"
        }
      }
    ],
    "createdAt": "2026-07-24T00:00:00Z",
    "updatedAt": "2026-07-24T00:00:00Z"
  }
}
