{
  "schema": "live-view-kit.v1",
  "id": "accounting-follow-through",
  "title": "Accounting follow-through",
  "description": "Review missing documents and payment follow-ups against authoritative connected sources.",
  "outcome": "Resolve the highest-confidence accounting exception while keeping uncertain matches and system boundaries visible.",
  "decisions": [
    "Which source-backed exception needs a human action now?",
    "Which possible document match requires review?",
    "What source or connection is missing before the books can be trusted?"
  ],
  "trustBoundary": "A missing claim requires an authoritative baseline, and the view never implies that screenpipe changed the books.",
  "version": 2,
  "pipes": [
    {
      "name": "accounting-follow-through",
      "distribution": "bundled"
    }
  ],
  "template": {
    "schema": "live-view-template.v1",
    "id": "accounting-follow-through",
    "title": "Accounting follow-through",
    "revision": 1,
    "timeRange": "30d",
    "periodPolicy": {
      "type": "selectable.v1",
      "values": ["7d", "30d"]
    },
    "blocks": [
      {
        "id": "accounting-exceptions",
        "title": "Needs attention",
        "kind": "list.v1",
        "width": 12,
        "order": 0,
        "intent": "List only source-backed accounting exceptions that need a human next action. Use a stable id and interactive fields. A missing claim requires an authoritative baseline and no credible match.",
        "source": {
          "type": "pipe.v1",
          "pipeName": "accounting-follow-through"
        }
      },
      {
        "id": "missing-count",
        "title": "Unresolved gaps",
        "kind": "metric.v1",
        "width": 3,
        "order": 1,
        "intent": "Count unresolved source-backed accounting exceptions. Do not count observations without an authoritative baseline.",
        "source": {
          "type": "pipe.v1",
          "pipeName": "accounting-follow-through"
        }
      },
      {
        "id": "coverage",
        "title": "Document coverage",
        "kind": "metric.v1",
        "width": 3,
        "order": 2,
        "intent": "Report matched-document coverage only when an authoritative baseline provides a valid denominator; otherwise state unavailable.",
        "source": {
          "type": "pipe.v1",
          "pipeName": "accounting-follow-through"
        }
      },
      {
        "id": "possible-matches",
        "title": "Possible matches",
        "kind": "table.v1",
        "width": 6,
        "order": 3,
        "intent": "Show uncertain document-to-record matches with the baseline record, candidate document, and why human review is still needed.",
        "source": {
          "type": "pipe.v1",
          "pipeName": "accounting-follow-through"
        }
      },
      {
        "id": "accounting-changes",
        "title": "Recently reconciled",
        "kind": "timeline.v1",
        "width": 6,
        "order": 4,
        "intent": "Show a concise receipt of accounting exceptions that were matched, corrected, dismissed, or materially changed.",
        "source": {
          "type": "pipe.v1",
          "pipeName": "accounting-follow-through"
        }
      },
      {
        "id": "accounting-boundary",
        "title": "Data boundary",
        "kind": "markdown.v1",
        "width": 6,
        "order": 5,
        "intent": "State which authoritative and evidence sources were available, what could not be verified, and the single safest next connection or action. Never imply that Screenpipe changed the books.",
        "source": {
          "type": "pipe.v1",
          "pipeName": "accounting-follow-through"
        }
      }
    ],
    "createdAt": "2026-07-29T00:00:00Z",
    "updatedAt": "2026-07-29T00:00:00Z"
  }
}
