{
  "schema": "live-view-kit.v1",
  "id": "automation-finder",
  "title": "Automation finder",
  "description": "Find one repeated workflow worth automating and turn it into a safe, testable first step.",
  "outcome": "Choose one source-backed automation trial with a modeled annual value range, explicit costs, and a human-controlled success test.",
  "decisions": [
    "Is this workflow repeated and costly enough to automate?",
    "How many annual hours and how much illustrative value could be recovered?",
    "What is the smallest safe trial, and what would stop it?"
  ],
  "trustBoundary": "Hours and dollars are modeled scenarios from visible assumptions, not realized savings, booked revenue, or a promise of payback.",
  "version": 2,
  "pipes": [
    {
      "name": "automate-my-work",
      "distribution": "bundled"
    }
  ],
  "template": {
    "schema": "live-view-template.v1",
    "id": "automation-finder",
    "title": "Automation finder",
    "revision": 1,
    "timeRange": "7d",
    "periodPolicy": {
      "type": "selectable.v1",
      "values": ["7d", "30d"]
    },
    "blocks": [
      {
        "id": "best-opportunity",
        "title": "Best automation opportunity",
        "kind": "markdown.v1",
        "width": 12,
        "order": 0,
        "intent": "Identify the single strongest repeated workflow to automate in the selected period, based on frequency, time cost, consistency, and feasibility.",
        "source": {
          "type": "pipe.v1",
          "pipeName": "automate-my-work"
        }
      },
      {
        "id": "workflow-evidence",
        "title": "When this workflow repeated",
        "kind": "timeline.v1",
        "width": 6,
        "order": 1,
        "intent": "Show timestamped examples of the selected workflow repeating during the selected period, with enough context to verify they are the same process.",
        "source": {
          "type": "pipe.v1",
          "pipeName": "automate-my-work"
        }
      },
      {
        "id": "friction",
        "title": "Why it is costly",
        "kind": "list.v1",
        "width": 6,
        "order": 2,
        "intent": "List the concrete friction, manual steps, delays, or error risk that make the selected workflow costly, grounded in observed examples.",
        "source": {
          "type": "pipe.v1",
          "pipeName": "automate-my-work"
        }
      },
      {
        "id": "annual-value-case",
        "title": "Annual opportunity model",
        "kind": "table.v1",
        "width": 12,
        "order": 3,
      "intent": "Show the selected workflow's observed frequency, observed minutes-per-run range, conservative automatable share, and working periods per year. Show the formula that produces modeled annual hours, then illustrate gross capacity at $50, $100, and $150 per recovered hour. For revenue work, show baseline eligible volume times a source-backed conversion change times contribution margin, or mark it unavailable. Label every dollar figure as a scenario, not realized savings or booked revenue. List unknown build, run, maintenance, review, adoption, and realization costs; do not calculate net value or payback without those inputs.",
        "source": {
          "type": "pipe.v1",
          "pipeName": "automate-my-work"
        }
      },
      {
        "id": "current-coverage",
        "title": "What is already covered",
        "kind": "table.v1",
        "width": 6,
        "order": 4,
        "intent": "Map which steps of the selected workflow are already handled by software or AI and which steps still require manual work.",
        "source": {
          "type": "pipe.v1",
          "pipeName": "automate-my-work"
        }
      },
      {
        "id": "safe-first-version",
        "title": "Safe first version",
        "kind": "markdown.v1",
        "width": 6,
        "order": 5,
        "intent": "Propose the smallest safe automation that removes meaningful work while keeping risky decisions or external writes behind human approval.",
        "source": {
          "type": "pipe.v1",
          "pipeName": "automate-my-work"
        }
      },
      {
        "id": "success-test",
        "title": "How to know it worked",
        "kind": "list.v1",
        "width": 12,
        "order": 6,
        "intent": "Define a bounded initial trial with an artifact-level success check, a before/after time measure, an accuracy or exception threshold, a human approval point, and an explicit stop condition. Separate first-run correctness from later realized time or financial value.",
        "source": {
          "type": "pipe.v1",
          "pipeName": "automate-my-work"
        }
      }
    ],
    "createdAt": "2026-07-24T00:00:00Z",
    "updatedAt": "2026-07-24T00:00:00Z"
  }
}
